{
  "schema_version": "0.1.0",
  "profile": {
    "id": "openodc-road-rules-cn",
    "version": "0.5.0",
    "title": {
      "zh": "OpenODC 中国道路规则义务映射",
      "en": "OpenODC China Road-Rule Obligation Mapping"
    },
    "description": {
      "zh": "把现行公开法规中的道路规则义务连接到 ODC 适用条件、场景触发点和候选证据。",
      "en": "Connects road-rule obligations from current public sources to ODC applicability, scenario triggers, and evidence candidates."
    },
    "jurisdiction": "CN",
    "source_status": "current-public-sources",
    "reviewed_on": "2026-07-14",
    "disclaimer": {
      "zh": "本数据用于工程研究、需求追溯和测试设计，不构成法律意见、认证结论或任何车型的符合性判定。",
      "en": "This dataset supports engineering research, requirements traceability, and test design. It is not legal advice, certification, or a compliance determination for any vehicle."
    }
  },
  "sources": [
    {
      "id": "cn-rtsa-2021",
      "type": "law",
      "title": {
        "zh": "《中华人民共和国道路交通安全法》（2021年修正）",
        "en": "Road Traffic Safety Law of the People’s Republic of China (2021 revision)"
      },
      "authority": {
        "zh": "全国人民代表大会常务委员会",
        "en": "Standing Committee of the National People’s Congress"
      },
      "status": "current",
      "url": "https://flk.npc.gov.cn/detail?fileId=&id=ff8081817ab231eb017abd617ef70519&title=%E4%B8%AD%E5%8D%8E%E4%BA%BA%E6%B0%91%E5%85%B1%E5%92%8C%E5%9B%BD%E9%81%93%E8%B7%AF%E4%BA%A4%E9%80%9A%E5%AE%89%E5%85%A8%E6%B3%95&type=",
      "checked_on": "2026-07-14",
      "version_evidence": {
        "official_repository": {
          "zh": "国家法律法规数据库",
          "en": "National Database of Laws and Regulations"
        },
        "record_identifier": "ff8081817ab231eb017abd617ef70519; 2021 revision",
        "fingerprint_scope": {
          "zh": "对官方公开记录的标识、题名、发布主体、版本、URL 和核验日期生成元数据指纹；不是网页正文副本。",
          "en": "Metadata fingerprint over the official record ID, title, authority, version, URL, and review date; it is not a copy of the webpage body."
        },
        "reference_fingerprint_sha256": "4dd5cb4433f6fca297f6662fc4bf7bbccf2e2eedf0d37613d37b4ebee8c79324"
      }
    },
    {
      "id": "cn-rtsa-reg-2017",
      "type": "administrative_regulation",
      "title": {
        "zh": "《中华人民共和国道路交通安全法实施条例》（2017年修订）",
        "en": "Regulation on the Implementation of the Road Traffic Safety Law (2017 revision)"
      },
      "authority": {
        "zh": "国务院",
        "en": "State Council of the People’s Republic of China"
      },
      "status": "current",
      "url": "https://xzfg.moj.gov.cn/front/law/detail?LawID=75&Query=%E9%81%93%E8%B7%AF%E4%BA%A4%E9%80%9A%E5%AE%89%E5%85%A8%E6%B3%95%E5%AE%9E%E6%96%BD%E6%9D%A1%E4%BE%8B",
      "checked_on": "2026-07-14",
      "version_evidence": {
        "official_repository": {
          "zh": "国家行政法规库",
          "en": "National Administrative Regulations Database"
        },
        "record_identifier": "LawID=75; 2017 revision",
        "fingerprint_scope": {
          "zh": "对官方公开记录的标识、题名、发布主体、版本、URL 和核验日期生成元数据指纹；不是网页正文副本。",
          "en": "Metadata fingerprint over the official record ID, title, authority, version, URL, and review date; it is not a copy of the webpage body."
        },
        "reference_fingerprint_sha256": "4f32d5f02854828a07fc7412cb92065134d151002242527d255dcb3f87c2c108"
      }
    },
    {
      "id": "gb5768-current",
      "type": "national_standard",
      "title": {
        "zh": "GB 5768《道路交通标志和标线》现行系列",
        "en": "Current GB 5768 series: Road Traffic Signs and Markings"
      },
      "authority": {
        "zh": "国家标准化管理委员会",
        "en": "Standardization Administration of China"
      },
      "status": "current",
      "url": "https://openstd.samr.gov.cn/bzgk/std/std_list?p.p1=0&p.p2=GB+5768&p.p90=circulation_date&p.p91=desc",
      "checked_on": "2026-07-14",
      "version_evidence": {
        "official_repository": {
          "zh": "全国标准信息公共服务平台",
          "en": "National Public Service Platform for Standards Information"
        },
        "record_identifier": "GB 5768 current-series query; checked 2026-07-14",
        "fingerprint_scope": {
          "zh": "对官方公开记录的标识、题名、发布主体、版本、URL 和核验日期生成元数据指纹；不是网页正文副本。",
          "en": "Metadata fingerprint over the official record ID, title, authority, version, URL, and review date; it is not a copy of the webpage body."
        },
        "reference_fingerprint_sha256": "5d9908698f8af8bcced2d2623addddeb5a95ac9fe9ef8ab759a2622de3c538c3"
      }
    },
    {
      "id": "gbt45312-2025",
      "type": "national_standard",
      "title": {
        "zh": "GB/T 45312-2025《智能网联汽车 自动驾驶系统设计运行条件》",
        "en": "GB/T 45312-2025 Operational design condition for automated driving system"
      },
      "authority": {
        "zh": "国家标准化管理委员会",
        "en": "Standardization Administration of China"
      },
      "status": "current",
      "url": "https://openstd.samr.gov.cn/bzgk/std/newGbInfo?hcno=0BECACFD363C754F6869F970BC78EE5A",
      "checked_on": "2026-07-14",
      "version_evidence": {
        "official_repository": {
          "zh": "全国标准信息公共服务平台",
          "en": "National Public Service Platform for Standards Information"
        },
        "record_identifier": "GB/T 45312-2025; hcno=0BECACFD363C754F6869F970BC78EE5A",
        "fingerprint_scope": {
          "zh": "对官方公开记录的标识、题名、发布主体、版本、URL 和核验日期生成元数据指纹；不是网页正文副本。",
          "en": "Metadata fingerprint over the official record ID, title, authority, version, URL, and review date; it is not a copy of the webpage body."
        },
        "reference_fingerprint_sha256": "5842c4ca3d96fc515c29d71552d0f4d95ba7cd0b937b0d9d85fb4070d5d4cba3"
      }
    }
  ],
  "obligations": [
    {
      "id": "rr.signal.police",
      "order": 1,
      "category": "traffic_signal",
      "title": {
        "zh": "服从交通警察指挥",
        "en": "Follow traffic-police directions"
      },
      "normative_rule": {
        "zh": "车辆和行人应按交通信号通行，遇现场指挥时按交通警察指挥通行。",
        "en": "Road users follow traffic signals and on-site police directions."
      },
      "normative_subject": {
        "kind": "road_user",
        "label": {
          "zh": "车辆和行人等道路交通参与者",
          "en": "Vehicles, pedestrians, and other road users"
        },
        "legal_boundary": {
          "zh": "法律义务主体以原始公开来源为准；OpenODC 不把自动驾驶系统本身表述为法律责任主体。",
          "en": "The legal subject is defined only by the original public source; OpenODC does not describe the automated-driving system itself as the legally responsible subject."
        }
      },
      "summary": {
        "zh": "现场交通警察指挥优先于其他交通信号；系统必须识别不能可靠处理的指挥并进入受控响应。",
        "en": "On-site police directions take precedence over other traffic signals; the system must detect unsupported directions and enter a controlled response."
      },
      "derivation": {
        "type": "engineering_candidate",
        "statement": {
          "zh": "服从现场指挥是公开规则；识别置信度不足时的减速和最小风险处置是 OpenODC 提出的工程候选，不是条文直接规定的 ADS 行为。",
          "en": "Following on-site directions is the public rule. Slowing and minimum-risk handling under uncertain recognition are OpenODC engineering candidates, not ADS behavior directly prescribed by the clause."
        }
      },
      "source_refs": [
        {
          "source_id": "cn-rtsa-2021",
          "clauses": [
            "第三十八条"
          ],
          "interpretation": {
            "zh": "车辆和行人应按交通信号通行，遇现场指挥时按交通警察指挥通行。",
            "en": "Road users follow traffic signals and on-site police directions."
          }
        }
      ],
      "odc_mappings": [
        {
          "element_id": "odd.infrastructure.traffic_control",
          "relation": "contextual",
          "rationale": {
            "zh": "OpenODC 目前仅有交通控制设施上位类，尚未独立建模警察手势。",
            "en": "OpenODC currently has only the traffic-control parent class and does not model police gestures separately."
          }
        },
        {
          "element_id": "odd.targets.pedestrian",
          "relation": "supporting",
          "rationale": {
            "zh": "交通警察首先表现为需要感知、分类和跟踪的人员目标。",
            "en": "A traffic officer is also a human target that must be perceived, classified, and tracked."
          }
        }
      ],
      "applicability": [
        {
          "id": "rr.signal.police.applicability",
          "condition": {
            "zh": "存在现场交通警察，或固定信号与现场指挥发生冲突。",
            "en": "An on-site traffic officer is present, or the direction conflicts with fixed signals."
          },
          "odc_element_ids": [
            "odd.infrastructure.traffic_control",
            "odd.targets.pedestrian"
          ]
        }
      ],
      "scenario_hooks": [
        {
          "id": "rr.signal.police.scenario",
          "trigger": {
            "zh": "警察给出停止、转弯、变道或靠边指挥。",
            "en": "An officer gives a stop, turn, lane-change, or pull-over direction."
          },
          "expected_response": {
            "zh": "优先服从可确认的指挥；无法可靠解释时减速、保持安全间距并进入最小风险处置。",
            "en": "Follow confirmed directions; if interpretation is unreliable, slow down, preserve clearance, and enter a minimum-risk response."
          },
          "evidence_candidates": [
            "requirements_trace",
            "simulation",
            "human_review"
          ]
        }
      ],
      "review": {
        "status": "public_source_and_engineering_mapping_reviewed",
        "reviewer_role": {
          "zh": "OpenODC 维护者",
          "en": "OpenODC maintainer"
        },
        "reviewed_on": "2026-07-14",
        "scope": {
          "zh": "核对公开来源、条款引用、法律主体边界、ODC 语义映射和工程推导标记。",
          "en": "Reviewed public sources, clause references, legal-subject boundaries, ODC semantic mappings, and engineering-derivation labels."
        }
      }
    },
    {
      "id": "rr.signal.light",
      "order": 2,
      "category": "traffic_signal",
      "title": {
        "zh": "遵守交通信号灯与停止线",
        "en": "Obey traffic lights and stop lines"
      },
      "normative_rule": {
        "zh": "交通信号灯属于统一交通信号，车辆应按信号通行。",